fecha,titulo,autor,enlace
2023-03-04,César Vázquez no descarta posible sorpresa y ganar las elecciones del 2024,Fernando A. Collazo,https://www.metro.pr/noticias/2023/03/04/cesar-vazquez-no-descarta-posible-sorpresa-y-ganar-las-elecciones-del-2024/
2023-03-04,Junta de Control Fiscal celebra eliminación de derechos a trabajadores del sector privado,Metro Puerto Rico,https://www.metro.pr/noticias/2023/03/04/junta-de-control-fiscal-celebra-eliminacion-de-derechos-a-trabajadores-del-sector-privado/
2023-03-04,"China: alza en gasto militar cubre ""desafíos de seguridad""",AP,https://www.metro.pr/noticias/2023/03/04/china-alza-en-gasto-militar-cubre-desafios-de-seguridad/
2023-03-04,¿Qué cambia al declararse nulas las enmiendas a la Reforma Laboral?,Metro Puerto Rico,https://www.metro.pr/noticias/2023/03/04/que-cambia-al-declararse-nulas-las-enmiendas-a-la-reforma-laboral/
2023-03-04,Policía llega a manifestación en Condominio Sol y Playa en Rincón ,Metro Puerto Rico,https://www.metro.pr/noticias/2023/03/04/policia-llega-a-manifestacion-en-condominio-sol-y-playa-en-rincon/
2023-03-04,Renuncia asesor del alcalde de Ponce tras expresiones homofóbicas de la primera dama,Metro Puerto Rico,https://www.metro.pr/noticias/2023/03/04/renuncia-asesor-del-alcalde-de-ponce-tras-expresiones-homofobicas-de-la-primera-dama/
2023-03-04,Incendian dos vehículos y una embarcación en Vieques,Metro Puerto Rico,https://www.metro.pr/noticias/2023/03/04/incendian-dos-vehiculos-y-una-embarcacion-en-vieques/
2023-03-04,Mujer muere en accidente de tránsito en Yabucoa,Cybernews,https://www.metro.pr/noticias/2023/03/04/mujer-muere-en-accidente-de-transito-en-yabucoa/
2023-03-04,Arrestan a tres personas en manifestación en Rincón,Cybernews,https://www.metro.pr/noticias/2023/03/04/arrestan-a-tres-personas-en-manifestacion-en-rincon/
2023-03-04,¡Fuera del agua! El mar estará peligroso durante el fin de semana ,Metro Puerto Rico,https://www.metro.pr/noticias/2023/03/04/fuera-del-agua-el-mar-estara-peligroso-durante-el-fin-de-semana/
2023-03-04,Doble asesinato y dos mujeres heridas de bala en Gurabo,Metro Puerto Rico,https://www.metro.pr/noticias/2023/03/04/doble-asesinato-y-dos-mujeres-heridas-de-bala-en-gurabo/
2023-03-04,"Con trauma en cabeza y brazo, hombre agredido en Yauco",Metro Puerto Rico,https://www.metro.pr/noticias/2023/03/04/con-trauma-en-cabeza-y-brazo-hombre-agredido-en-yauco/
2023-03-03,Biden y Scholz discuten guerra de Ucrania en la Casa Blanca,AP,https://www.metro.pr/noticias/2023/03/03/biden-y-scholz-discuten-guerra-de-ucrania-en-la-casa-blanca/
2023-03-03,Wall Street registra su mejor jornada en seis semanas,AP,https://www.metro.pr/noticias/2023/03/03/wall-street-registra-su-mejor-jornada-en-seis-semanas/
2023-03-03,Zelenski pide que Rusia sea procesada por delitos de guerra,AP,https://www.metro.pr/noticias/2023/03/04/zelenskyy-pide-que-rusia-sea-procesada-por-delitos-de-guerra/
2023-03-03,“No escuchan al pueblo”; reinician protestas en Perú contra la presidenta Dina Boluarte,AP,https://www.metro.pr/noticias/2023/03/03/peru-reinician-protestas-en-lima-contra-presidenta-boluarte/
2023-03-03,Presidente Biden fue intervenido para removerle lesión cancerosa del pecho,AP,https://www.metro.pr/noticias/2023/03/03/presidente-biden-fue-intervenido-para-removerle-lesion-cancerosa-del-pecho/
2023-03-03,Ecuador: piden arresto domiciliario para expresidente Moreno,AP,https://www.metro.pr/noticias/2023/03/03/ecuador-piden-arresto-domiciliario-para-expresidente-moreno/
2023-03-03,Estados Unidos y Ucrania tantean la posibilidad de crear un tribunal para castigar a Rusia,Europa PressRicardo Vázquez,https://www.metro.pr/noticias/2023/03/03/estados-unidos-y-ucrania-tantean-la-posibilidad-de-crear-un-tribunal-para-castigar-a-rusia/
2023-03-03,Miles protestan en Grecia por víctimas del choque de trenes,AP,https://www.metro.pr/noticias/2023/03/03/miles-protestan-en-grecia-por-victimas-del-choque-de-trenes/
2023-03-03,Tormentas se dirigen al noreste de EEUU tras azotar el sur,AP,https://www.metro.pr/noticias/2023/03/04/tormentas-se-dirigen-al-noreste-de-eeuu-tras-azotar-el-sur/
2023-03-03,Muere persona ahogada en playa de Arecibo,Metro Puerto Rico,https://www.metro.pr/noticias/2023/03/03/muere-persona-ahogada-en-playa-de-arecibo/
2023-03-03,"Astronautas de Estados Unidos, Rusia y Emiratos llega a la estación espacial ",AP,https://www.metro.pr/noticias/2023/03/03/astronautas-de-estados-unidos-rusia-y-emiratos-llega-a-la-estacion-espacial/
2023-03-03,"Se tumban refrescos, platos y hasta el aceite de cocinar de negocio en Villalba ",Metro Puerto Rico,https://www.metro.pr/noticias/2023/03/03/se-tumban-refrescos-platos-y-hasta-el-aceite-de-cocinar-de-negocio-en-villalba/
2023-03-03,Hallan auto quemado en Camuy reportado como robado en la zona de Bayamón ,Metro Puerto Rico,https://www.metro.pr/noticias/2023/03/03/hallan-auto-quemado-en-camuy-reportado-como-robado-en-la-zona-de-bayamon/
2023-03-03,Mujer se echa alcohol y se inmola en Vieques ,Cybernews,https://www.metro.pr/noticias/2023/03/03/mujer-se-echa-alcohol-y-se-inmola-en-vieques/
2023-03-03,Apelaciones determina que OPFEI no tiene jurisdicción en caso de compra de pruebas de COVID-19,Metro Puerto Rico,https://www.metro.pr/noticias/2023/03/03/apelaciones-determina-que-opfei-no-tiene-jurisdiccion-en-caso-de-compra-de-pruebas-de-covid-19/
2023-03-03,Se llevan $200 y un Jeep de taller en Río Grande,Metro Puerto Rico,https://www.metro.pr/noticias/2023/03/03/se-llevan-200-y-un-jeep-de-taller-en-rio-grande/
2023-03-03,Buscan a joven de 21 años reportado como desaparecido en Arecibo ,Metro Puerto Rico,https://www.metro.pr/noticias/2023/03/03/buscan-a-joven-de-21-anos-reportado-como-desaparecido-en-arecibo/
2023-03-03,"Sobre 2,400 casos de sobredosis se han registrado en la isla desde el 2019 ",Metro Puerto Rico,https://www.metro.pr/noticias/2023/03/03/sobre-2400-casos-de-sobredosis-se-han-registrado-en-la-isla-desde-el-2019/
2023-03-03,Morovis inaugura su primer parque pasivo recreativo con acceso a personas con impedimentos,Metro Puerto Rico,https://www.metro.pr/noticias/2023/03/03/morovis-inaugura-su-primer-parque-pasivo-recreativo-con-acceso-a-personas-con-impedimentos/
2023-03-03,Se llevan el pony de una hacienda en Ponce ,Metro Puerto Rico,https://www.metro.pr/noticias/2023/03/03/se-llevan-el-pony-de-una-hacienda-en-ponce/
2023-03-03,Buscan a joven de 18 años desaparecido en Vega Alta,Metro Puerto Rico,https://www.metro.pr/noticias/2023/03/03/buscan-a-joven-de-18-anos-desaparecido-en-vega-alta/
2023-03-03,¡Escándalo en el PSG! Hakimi es acusado de presunta violación,AP,https://www.metro.pr/noticias/2023/03/03/fiscalia-francesa-acusa-a-hakimi-de-supuesta-violacion/
2023-03-03,Añejo restaurante resalta renacimiento arqueológico de Irak,AP,https://www.metro.pr/noticias/2023/03/03/anejo-restaurante-resalta-renacimiento-arqueologico-de-irak/
2023-03-03,Ecologistas protestan contra política de transporte alemana,AP,https://www.metro.pr/noticias/2023/03/03/ecologistas-protestan-contra-politica-de-transporte-alemana/
2023-03-03,Después de la lluvia y la nieve reciente algunas regiones de California están libres de sequía,María José González,https://www.metro.pr/noticias/2023/03/03/despues-de-la-lluvia-y-la-nieve-reciente-algunas-regiones-de-california-estan-libres-de-sequia/
2023-03-03,Representantes apoyan solicitud para que en P. R. se vote por presidente de EE. UU. ,Metro Puerto Rico,https://www.metro.pr/noticias/2023/03/03/representantes-apoyan-solicitud-para-que-en-p-r-se-vote-por-presidente-de-ee-uu/
2023-03-03,Condenan a Premio Nobel de la Paz a 10 años de cárcel en Bielorrusia,APRicardo Vázquez,https://www.metro.pr/noticias/2023/03/03/bielorrusia-sentencia-a-nobel-bialiatski-a-10-anos-de-carcel/
2023-03-03,Cadena perpetua a abogado convicto de matar a esposa e hijo,AP,https://www.metro.pr/noticias/2023/03/03/cadena-perpetua-a-abogado-convicto-de-matar-a-esposa-e-hijo/
2023-03-03,Muere persona en Florida por una ameba comecerebros,Adrialis Barrios,https://www.metro.pr/noticias/2023/03/03/muere-persona-en-florida-por-una-ameba-comecerebros/
2023-03-03,OMS insiste sobre el origen del Covid-19: “Todas las hipótesis siguen sobre la mesa”,Europa Press,https://www.metro.pr/noticias/2023/03/03/la-oms-insiste-sobre-el-origen-del-coronavirus-todas-las-hipotesis-siguen-sobre-la-mesa/
2023-03-03,Tiran al medio a maestra que se acostó con el padre de uno de sus estudiantes ,Publimetro México,https://www.metro.pr/noticias/2023/03/03/tiran-al-medio-a-maestra-que-se-acosto-con-el-padre-de-uno-de-sus-estudiantes/
2023-03-03,Lo que el juicio de Alex Murdaugh refleja de EEUU,AP,https://www.metro.pr/noticias/2023/03/03/lo-que-el-juicio-de-alex-murdaugh-refleja-de-eeuu/
2023-03-03,Cargos contra hombre por agarrar por cuello a su hijo de 10 años tras discusión por su conducta,Metro Puerto Rico,https://www.metro.pr/noticias/2023/03/03/cargos-contra-hombre-por-agarrar-por-cuello-a-su-hijo-de-10-anos-tras-discusion-por-su-conducta/
2023-03-03,Jenniffer González asegura que no duda de “las buenas intenciones” de Pierluisi como gobernador,Metro Puerto Rico,https://www.metro.pr/noticias/2023/03/03/jenniffer-gonzalez-asegura-que-no-duda-de-las-buenas-intenciones-de-pierluisi-como-gobernador/
2023-03-03,Estados Unidos y Corea del Sur anuncian próximas maniobras,AP,https://www.metro.pr/noticias/2023/03/03/eeuu-y-corea-del-sur-anuncian-proximas-maniobras/
2023-03-03,Agentes ocupan arma de alto poder en residencial de Cupey,Metro Puerto Rico,https://www.metro.pr/noticias/2023/03/03/agentes-ocupan-arma-de-alto-poder-en-residencial-de-cupey/
2023-03-02,Alexandria Ocasio-Cortez pudo haber violado leyes de ética con su aparición en la Met Gala 2021,Metro Puerto Rico,https://www.metro.pr/noticias/2023/03/03/alexandria-ocasio-cortez-pudo-haber-violado-leyes-de-etica-con-su-aparicion-en-la-met-gala-2021/
2023-03-02,Tornados azotan Texas y Luisiana; cancelan vuelos en Dallas,AP,https://www.metro.pr/noticias/2023/03/03/tornados-azotan-texas-y-luisiana-cancelan-vuelos-en-dallas/
2023-03-02,Hispanos que reportan emergencias se las ven complicadas por estatus migratorio e idioma,Grisel García,https://www.metro.pr/noticias/2023/03/03/hispanos-que-reportan-emergencias-se-las-ven-complicadas-por-estatus-migratorio-e-idioma/
